{
  "$schema": "../../../_templates/component/tokens.schema.json",
  "component": "confidence-meter",
  "source": "https://github.com/tishsingh399/clementine-ds",
  "version": "clementine-ds@0.1.0",
  "verified": "2026-06-10",
  "fork_model": "3-tier cascade: component → semantic → primitive.",
  "notes": [
    "Defined in packages/tokens/src/components/confidence-meter.json. AI surface (Wave D)."
  ],
  "tokens": [
    { "name": "confidence-meter.track", "tier": "component", "role": "track", "path": "confidence-meter.track", "references": "{surface.subtle}", "primitive": "{palette.neutral.2}", "light": "#f6f6f4", "status": "existing" },
    { "name": "confidence-meter.high", "tier": "component", "role": "high", "path": "confidence-meter.high", "references": "{feedback.success}", "primitive": "{palette.green.9}", "light": "#198044", "status": "existing" },
    { "name": "confidence-meter.medium", "tier": "component", "role": "medium", "path": "confidence-meter.medium", "references": "{feedback.warning}", "primitive": "{palette.amber.11}", "light": "#855905", "status": "existing" },
    { "name": "confidence-meter.low", "tier": "component", "role": "low", "path": "confidence-meter.low", "references": "{feedback.error}", "primitive": "{palette.red.9}", "light": "#c1332f", "status": "existing" },
    { "name": "confidence-meter.label", "tier": "component", "role": "label", "path": "confidence-meter.label", "references": "{text.secondary}", "primitive": "{palette.neutral.11}", "light": "#65635e", "status": "existing" }
  ]
}
