{
  "$schema": "../../_templates/component/tokens.schema.json",
  "component": "bulk-action-bar",
  "source": "https://github.com/tishsingh399/clementine-ds",
  "version": "clementine-ds@0.1.0",
  "verified": "2026-06-10",
  "fork_model": "3-tier cascade: component → semantic → primitive.",
  "notes": [
    "Defined in packages/tokens/src/components/bulk-action-bar.json. Enterprise layer (Wave H)."
  ],
  "tokens": [
    { "name": "bulk-action-bar.bg", "tier": "component", "role": "bg", "path": "bulk-action-bar.bg", "references": "{surface.subtle}", "primitive": "{palette.neutral.2}", "light": "#f6f6f4", "status": "existing" },
    { "name": "bulk-action-bar.border", "tier": "component", "role": "border", "path": "bulk-action-bar.border", "references": "{border.default}", "primitive": "{palette.neutral.6}", "light": "#d5d3d0", "status": "existing" },
    { "name": "bulk-action-bar.fg", "tier": "component", "role": "fg", "path": "bulk-action-bar.fg", "references": "{text.primary}", "primitive": "{palette.neutral.12}", "light": "#2a2926", "status": "existing" }
  ]
}
