{
  "$schema": "../../../_templates/component/tokens.schema.json",
  "component": "hitl-gate",
  "source": "https://github.com/tishsingh399/clementine-ds",
  "version": "clementine-ds@0.1.0",
  "verified": "2026-06-10",
  "fork_model": "3-tier cascade: component → semantic → primitive.",
  "notes": [
    "Defined in packages/tokens/src/components/hitl-gate.json. Tray 4 (AI surface)."
  ],
  "tokens": [
    { "name": "hitl.bg", "tier": "component", "role": "container-fill", "path": "hitl.bg", "references": "{feedback.warning-subtle}", "primitive": "{palette.amber.3}", "light": "#ffebcf", "status": "existing" },
    { "name": "hitl.border", "tier": "component", "role": "container-border", "path": "hitl.border", "references": "{feedback.warning}", "primitive": "{palette.amber.11}", "light": "#855905", "status": "existing" },
    { "name": "hitl.title", "tier": "component", "role": "title-text", "path": "hitl.title", "references": "{text.primary}", "primitive": "{palette.neutral.12}", "light": "#2a2926", "status": "existing" },
    { "name": "hitl.body", "tier": "component", "role": "body-text", "path": "hitl.body", "references": "{text.secondary}", "primitive": "{palette.neutral.11}", "light": "#65635e", "status": "existing" },
    { "name": "hitl.approve-bg", "tier": "component", "role": "approve-fill", "path": "hitl.approve-bg", "references": "{action.primary}", "primitive": "{palette.ink.9}", "light": "#305eb7", "status": "existing" },
    { "name": "hitl.approve-destructive-bg", "tier": "component", "role": "approve-destructive", "path": "hitl.approve-destructive-bg", "references": "{action.destructive}", "primitive": "{palette.red.9}", "light": "#c1332f", "status": "existing" },
    { "name": "hitl.deny-bg", "tier": "component", "role": "deny-fill", "path": "hitl.deny-bg", "references": "{surface.subtle}", "primitive": "{palette.neutral.2}", "light": "#f6f6f4", "status": "existing" },
    { "name": "hitl.radius", "tier": "component", "role": "corner-radius", "path": "hitl.radius", "references": "{radius.md}", "primitive": "6px", "light": "6px", "status": "existing" }
  ]
}
