{
  "$schema": "../../../_templates/component/tokens.schema.json",
  "component": "code-block",
  "source": "https://github.com/tishsingh399/clementine-ds",
  "version": "clementine-ds@0.1.0",
  "verified": "2026-06-10",
  "fork_model": "3-tier cascade: component → semantic → primitive.",
  "notes": [
    "Defined in packages/tokens/src/components/code-block.json. AI surface (Wave D)."
  ],
  "tokens": [
    { "name": "code-block.bg", "tier": "component", "role": "bg", "path": "code-block.bg", "references": "{surface.elevated}", "primitive": "{color.white}", "light": "#ffffff", "status": "existing" },
    { "name": "code-block.header-bg", "tier": "component", "role": "header-bg", "path": "code-block.header-bg", "references": "{surface.subtle}", "primitive": "{palette.neutral.2}", "light": "#f6f6f4", "status": "existing" },
    { "name": "code-block.border", "tier": "component", "role": "border", "path": "code-block.border", "references": "{border.default}", "primitive": "{palette.neutral.6}", "light": "#d5d3d0", "status": "existing" },
    { "name": "code-block.fg", "tier": "component", "role": "fg", "path": "code-block.fg", "references": "{text.primary}", "primitive": "{palette.neutral.12}", "light": "#2a2926", "status": "existing" },
    { "name": "code-block.filename", "tier": "component", "role": "filename", "path": "code-block.filename", "references": "{text.tertiary}", "primitive": "{palette.neutral.10}", "light": "#6e6b65", "status": "existing" },
    { "name": "code-block.radius", "tier": "component", "role": "radius", "path": "code-block.radius", "references": "{radius.md}", "primitive": "6px", "light": "6px", "status": "existing" }
  ]
}
