{
  "$schema": "../../../_templates/component/tokens.schema.json",
  "component": "message",
  "source": "https://github.com/tishsingh399/clementine-ds",
  "version": "clementine-ds@HEAD",
  "verified": "2026-06-10",
  "fork_model": "3-tier cascade: component → semantic → primitive.",
  "notes": ["Defined in packages/tokens/src/components/message.json. Tray 4 (AI surface)."],
  "tokens": [
    { "name": "message.user.bg",      "tier": "component", "role": "user-fill",      "path": "message.user.bg",      "references": "{action.primary}",  "primitive": "{color.blue.6}", "light": "#2563eb", "status": "existing" },
    { "name": "message.user.fg",      "tier": "component", "role": "user-text",      "path": "message.user.fg",      "references": "{text.on-action}",  "primitive": "{color.white}",  "light": "#ffffff", "status": "existing" },
    { "name": "message.assistant.bg", "tier": "component", "role": "assistant-fill", "path": "message.assistant.bg", "references": "{surface.subtle}",  "primitive": "{color.gray.1}", "light": "#f3f3f0", "status": "existing" },
    { "name": "message.assistant.fg", "tier": "component", "role": "assistant-text", "path": "message.assistant.fg", "references": "{text.primary}",    "primitive": "{color.gray.9}", "light": "#1a1a18", "status": "existing" },
    { "name": "message.system.bg",    "tier": "component", "role": "system-fill",    "path": "message.system.bg",    "references": "{surface.default}", "primitive": "{color.gray.0}", "light": "#fafaf8", "status": "existing" },
    { "name": "message.system.fg",    "tier": "component", "role": "system-text",    "path": "message.system.fg",    "references": "{text.secondary}",  "primitive": "{color.gray.6}", "light": "#6b6b66", "status": "existing" },
    { "name": "message.meta",         "tier": "component", "role": "meta-text",      "path": "message.meta",         "references": "{text.tertiary}",   "primitive": "{color.gray.4}", "light": "#a3a39e", "status": "existing" },
    { "name": "message.radius",       "tier": "component", "role": "corner-radius",  "path": "message.radius",       "references": "{radius.lg}",       "primitive": "8px",            "light": "8px",     "status": "existing" }
  ]
}
