{
  "$schema": "../../_templates/component/tokens.schema.json",
  "component": "radio",
  "source": "https://github.com/tishsingh399/clementine-ds",
  "version": "clementine-ds@0.1.0",
  "verified": "2026-06-08",
  "fork_model": "3-tier cascade: component → semantic → primitive.",
  "notes": [
    "All entries are tier=component, defined in packages/tokens/src/components/radio.json."
  ],
  "tokens": [
    { "name": "radio.bg.unchecked", "tier": "component", "role": "unchecked-fill", "path": "radio.bg.unchecked", "references": "{surface.elevated}", "primitive": "{color.white}", "light": "#ffffff", "status": "existing" },
    { "name": "radio.bg.disabled", "tier": "component", "role": "disabled-fill", "path": "radio.bg.disabled", "references": "{surface.subtle}", "primitive": "{palette.neutral.3}", "light": "#efeeec", "status": "existing" },
    { "name": "radio.dot.checked", "tier": "component", "role": "checked-dot", "path": "radio.dot.checked", "references": "{action.primary}", "primitive": "{palette.ink.9}", "light": "#305eb7", "status": "existing" },
    { "name": "radio.border.default", "tier": "component", "role": "unchecked-border", "path": "radio.border.default", "references": "{border.strong}", "primitive": "{palette.neutral.9}", "light": "#83807a", "status": "existing" },
    { "name": "radio.border.checked", "tier": "component", "role": "checked-border", "path": "radio.border.checked", "references": "{action.primary}", "primitive": "{palette.ink.9}", "light": "#305eb7", "status": "existing" },
    { "name": "radio.border.focus", "tier": "component", "role": "focus-ring", "path": "radio.border.focus", "references": "{focus.ring}", "primitive": "{palette.clementine.10}", "light": "#e86800", "status": "existing" },
    { "name": "radio.fg.label", "tier": "component", "role": "label-color", "path": "radio.fg.label", "references": "{text.primary}", "primitive": "{palette.neutral.12}", "light": "#2a2926", "status": "existing" }
  ]
}
