{
  "$schema": "../../_templates/component/tokens.schema.json",
  "component": "rbac-matrix",
  "source": "https://github.com/tishsingh399/clementine-ds",
  "version": "clementine-ds@0.1.0",
  "verified": "2026-06-10",
  "fork_model": "3-tier cascade: component → semantic → primitive.",
  "notes": [
    "Defined in packages/tokens/src/components/rbac-matrix.json. Enterprise layer (Wave H)."
  ],
  "tokens": [
    { "name": "rbac-matrix.header-bg", "tier": "component", "role": "header-bg", "path": "rbac-matrix.header-bg", "references": "{surface.subtle}", "primitive": "{palette.neutral.2}", "light": "#f6f6f4", "status": "existing" },
    { "name": "rbac-matrix.border", "tier": "component", "role": "border", "path": "rbac-matrix.border", "references": "{border.default}", "primitive": "{palette.neutral.6}", "light": "#d5d3d0", "status": "existing" },
    { "name": "rbac-matrix.granted", "tier": "component", "role": "granted", "path": "rbac-matrix.granted", "references": "{action.primary}", "primitive": "{palette.ink.9}", "light": "#305eb7", "status": "existing" },
    { "name": "rbac-matrix.fg", "tier": "component", "role": "fg", "path": "rbac-matrix.fg", "references": "{text.primary}", "primitive": "{palette.neutral.12}", "light": "#2a2926", "status": "existing" }
  ]
}
