{
  "$schema": "../../../_templates/component/tokens.schema.json",
  "component": "permission-request",
  "source": "https://github.com/tishsingh399/clementine-ds",
  "version": "clementine-ds@0.1.0",
  "verified": "2026-06-10",
  "fork_model": "3-tier cascade: component → semantic → primitive.",
  "notes": [
    "Defined in packages/tokens/src/components/permission-request.json. AI surface long-tail (Wave F)."
  ],
  "tokens": [
    { "name": "permission-request.bg", "tier": "component", "role": "bg", "path": "permission-request.bg", "references": "{feedback.warning-subtle}", "primitive": "{palette.amber.3}", "light": "#ffebcf", "status": "existing" },
    { "name": "permission-request.border", "tier": "component", "role": "border", "path": "permission-request.border", "references": "{feedback.warning}", "primitive": "{palette.amber.11}", "light": "#855905", "status": "existing" },
    { "name": "permission-request.title", "tier": "component", "role": "title", "path": "permission-request.title", "references": "{text.primary}", "primitive": "{palette.neutral.12}", "light": "#2a2926", "status": "existing" },
    { "name": "permission-request.scope-bg", "tier": "component", "role": "scope-bg", "path": "permission-request.scope-bg", "references": "{surface.subtle}", "primitive": "{palette.neutral.3}", "light": "#efeeec", "status": "existing" }
  ]
}
