{
  "$schema": "../../../_templates/component/tokens.schema.json",
  "component": "agent-picker",
  "source": "https://github.com/tishsingh399/clementine-ds",
  "version": "clementine-ds@HEAD",
  "verified": "2026-06-10",
  "fork_model": "3-tier cascade: component → semantic → primitive.",
  "notes": [
    "Defined in packages/tokens/src/components/agent-picker.json. AI surface long-tail (Wave F)."
  ],
  "tokens": [
    {
      "name": "agent-picker.bg",
      "tier": "component",
      "role": "bg",
      "path": "agent-picker.bg",
      "references": "{surface.elevated}",
      "primitive": "{color.white}",
      "light": "#ffffff",
      "status": "existing"
    },
    {
      "name": "agent-picker.border",
      "tier": "component",
      "role": "border",
      "path": "agent-picker.border",
      "references": "{border.default}",
      "primitive": "{color.gray.2}",
      "light": "#e5e5e0",
      "status": "existing"
    },
    {
      "name": "agent-picker.fg",
      "tier": "component",
      "role": "fg",
      "path": "agent-picker.fg",
      "references": "{text.primary}",
      "primitive": "{color.gray.9}",
      "light": "#1a1a18",
      "status": "existing"
    },
    {
      "name": "agent-picker.icon",
      "tier": "component",
      "role": "icon",
      "path": "agent-picker.icon",
      "references": "{text.secondary}",
      "primitive": "{color.gray.6}",
      "light": "#6b6b66",
      "status": "existing"
    }
  ]
}
