{
  "$schema": "../../_templates/component/tokens.schema.json",
  "component": "fab",
  "source": "https://github.com/tishsingh399/clementine-ds",
  "version": "clementine-ds@0.1.0",
  "verified": "2026-06-10",
  "fork_model": "3-tier cascade: component → semantic → primitive.",
  "notes": [
    "Defined in packages/tokens/src/components/fab.json. Part 1 finisher (Wave E)."
  ],
  "tokens": [
    { "name": "fab.bg", "tier": "component", "role": "bg", "path": "fab.bg", "references": "{action.primary}", "primitive": "{palette.ink.9}", "light": "#305eb7", "status": "existing" },
    { "name": "fab.fg", "tier": "component", "role": "fg", "path": "fab.fg", "references": "{text.on-action}", "primitive": "{color.white}", "light": "#ffffff", "status": "existing" },
    { "name": "fab.shadow", "tier": "component", "role": "shadow", "path": "fab.shadow", "references": "{shadow.lg}", "primitive": "0 8px 24px rgba(0,0,0,0.16)", "light": "0 8px 24px rgba(0,0,0,0.16)", "status": "existing" },
    { "name": "fab.radius", "tier": "component", "role": "radius", "path": "fab.radius", "references": "{radius.xl}", "primitive": "99px", "light": "99px", "status": "existing" }
  ]
}
