{
  "$schema": "../../_templates/component/tokens.schema.json",
  "component": "anchor",
  "source": "https://github.com/tishsingh399/clementine-ds",
  "version": "clementine-ds@0.1.0",
  "verified": "2026-06-10",
  "fork_model": "3-tier cascade: component → semantic → primitive.",
  "notes": [
    "Defined in packages/tokens/src/components/anchor.json. Core staple (Wave A)."
  ],
  "tokens": [
    { "name": "anchor.fg", "tier": "component", "role": "fg", "path": "anchor.fg", "references": "{text.link}", "primitive": "{palette.ink.11}", "light": "#3960ab", "status": "existing" },
    { "name": "anchor.fg-hover", "tier": "component", "role": "fg-hover", "path": "anchor.fg-hover", "references": "{action.primary}", "primitive": "{palette.ink.9}", "light": "#305eb7", "status": "existing" }
  ]
}
