{
  "$schema": "../../_templates/component/tokens.schema.json",
  "component": "alert",
  "source": "https://github.com/tishsingh399/clementine-ds",
  "version": "clementine-ds@0.1.0",
  "verified": "2026-06-10",
  "fork_model": "3-tier cascade: component → semantic → primitive.",
  "notes": [
    "All entries are tier=component, defined in packages/tokens/src/components/alert.json."
  ],
  "tokens": [
    { "name": "alert.bg.info", "tier": "component", "role": "info-fill", "path": "alert.bg.info", "references": "{surface.subtle}", "primitive": "{palette.neutral.2}", "light": "#f6f6f4", "status": "existing" },
    { "name": "alert.bg.success", "tier": "component", "role": "success-fill", "path": "alert.bg.success", "references": "{feedback.success-subtle}", "primitive": "{palette.green.3}", "light": "#ddf5e2", "status": "existing" },
    { "name": "alert.bg.warning", "tier": "component", "role": "warning-fill", "path": "alert.bg.warning", "references": "{feedback.warning-subtle}", "primitive": "{palette.amber.3}", "light": "#ffebcf", "status": "existing" },
    { "name": "alert.bg.error", "tier": "component", "role": "error-fill", "path": "alert.bg.error", "references": "{feedback.error-subtle}", "primitive": "{palette.red.3}", "light": "#fee8e5", "status": "existing" },
    { "name": "alert.border.info", "tier": "component", "role": "info-border", "path": "alert.border.info", "references": "{border.default}", "primitive": "{palette.neutral.6}", "light": "#d5d3d0", "status": "existing" },
    { "name": "alert.border.success", "tier": "component", "role": "success-border", "path": "alert.border.success", "references": "{feedback.success}", "primitive": "{palette.green.9}", "light": "#198044", "status": "existing" },
    { "name": "alert.border.warning", "tier": "component", "role": "warning-border", "path": "alert.border.warning", "references": "{feedback.warning}", "primitive": "{palette.amber.11}", "light": "#855905", "status": "existing" },
    { "name": "alert.border.error", "tier": "component", "role": "error-border", "path": "alert.border.error", "references": "{feedback.error}", "primitive": "{palette.red.9}", "light": "#c1332f", "status": "existing" },
    { "name": "alert.fg.title", "tier": "component", "role": "title-color", "path": "alert.fg.title", "references": "{text.primary}", "primitive": "{palette.neutral.12}", "light": "#2a2926", "status": "existing" },
    { "name": "alert.fg.body", "tier": "component", "role": "body-color", "path": "alert.fg.body", "references": "{text.secondary}", "primitive": "{palette.neutral.11}", "light": "#65635e", "status": "existing" },
    { "name": "alert.icon.info", "tier": "component", "role": "info-icon", "path": "alert.icon.info", "references": "{text.secondary}", "primitive": "{palette.neutral.11}", "light": "#65635e", "status": "existing" },
    { "name": "alert.icon.success", "tier": "component", "role": "success-icon", "path": "alert.icon.success", "references": "{feedback.success}", "primitive": "{palette.green.9}", "light": "#198044", "status": "existing" },
    { "name": "alert.icon.warning", "tier": "component", "role": "warning-icon", "path": "alert.icon.warning", "references": "{feedback.warning}", "primitive": "{palette.amber.11}", "light": "#855905", "status": "existing" },
    { "name": "alert.icon.error", "tier": "component", "role": "error-icon", "path": "alert.icon.error", "references": "{feedback.error}", "primitive": "{palette.red.9}", "light": "#c1332f", "status": "existing" },
    { "name": "alert.radius", "tier": "component", "role": "corner-radius", "path": "alert.radius", "references": "{radius.md}", "primitive": "6px", "light": "6px", "status": "existing" }
  ]
}
