{
  "$schema": "../../_templates/component/tokens.schema.json",
  "component": "calendar",
  "source": "https://github.com/tishsingh399/clementine-ds",
  "version": "clementine-ds@0.1.0",
  "verified": "2026-06-11",
  "fork_model": "3-tier cascade: component → semantic → primitive.",
  "notes": [
    "Defined in packages/tokens/src/components/calendar.json. Dependency-gated (@mantine/dates)."
  ],
  "tokens": [
    { "name": "calendar.bg", "tier": "component", "role": "panel-fill", "path": "calendar.bg", "references": "{surface.elevated}", "primitive": "{color.white}", "light": "#ffffff", "status": "existing" },
    { "name": "calendar.fg", "tier": "component", "role": "day-text", "path": "calendar.fg", "references": "{text.primary}", "primitive": "{palette.neutral.12}", "light": "#2a2926", "status": "existing" },
    { "name": "calendar.header-fg", "tier": "component", "role": "header-text", "path": "calendar.header-fg", "references": "{text.primary}", "primitive": "{palette.neutral.12}", "light": "#2a2926", "status": "existing" },
    { "name": "calendar.weekday-fg", "tier": "component", "role": "weekday-text", "path": "calendar.weekday-fg", "references": "{text.secondary}", "primitive": "{palette.neutral.11}", "light": "#65635e", "status": "existing" },
    { "name": "calendar.day-today-border", "tier": "component", "role": "today-outline", "path": "calendar.day-today-border", "references": "{action.primary}", "primitive": "{palette.ink.9}", "light": "#305eb7", "status": "existing" },
    { "name": "calendar.day-muted-fg", "tier": "component", "role": "out-of-month-text", "path": "calendar.day-muted-fg", "references": "{text.tertiary}", "primitive": "{palette.neutral.10}", "light": "#6e6b65", "status": "existing" },
    { "name": "calendar.ring", "tier": "component", "role": "focus-ring", "path": "calendar.ring", "references": "{focus.ring}", "primitive": "{palette.clementine.10}", "light": "#e86800", "status": "existing" }
  ]
}
