{
  "$schema": "../../../_templates/component/tokens.schema.json",
  "component": "artifact-frame",
  "source": "https://github.com/tishsingh399/clementine-ds",
  "version": "clementine-ds@0.1.0",
  "verified": "2026-06-10",
  "fork_model": "3-tier cascade: component → semantic → primitive.",
  "notes": [
    "Defined in packages/tokens/src/components/artifact-frame.json. Tray 4 (AI surface)."
  ],
  "tokens": [
    { "name": "artifact.bg", "tier": "component", "role": "body-fill", "path": "artifact.bg", "references": "{surface.elevated}", "primitive": "{color.white}", "light": "#ffffff", "status": "existing" },
    { "name": "artifact.header-bg", "tier": "component", "role": "header-fill", "path": "artifact.header-bg", "references": "{surface.subtle}", "primitive": "{palette.neutral.3}", "light": "#efeeec", "status": "existing" },
    { "name": "artifact.border", "tier": "component", "role": "frame-border", "path": "artifact.border", "references": "{border.default}", "primitive": "{palette.neutral.6}", "light": "#d5d3d0", "status": "existing" },
    { "name": "artifact.title", "tier": "component", "role": "title-text", "path": "artifact.title", "references": "{text.primary}", "primitive": "{palette.neutral.12}", "light": "#2a2926", "status": "existing" },
    { "name": "artifact.kind", "tier": "component", "role": "kind-text", "path": "artifact.kind", "references": "{text.tertiary}", "primitive": "{palette.neutral.10}", "light": "#6e6b65", "status": "existing" },
    { "name": "artifact.radius", "tier": "component", "role": "corner-radius", "path": "artifact.radius", "references": "{radius.md}", "primitive": "6px", "light": "6px", "status": "existing" }
  ]
}
