{
  "$schema": "../../_templates/component/tokens.schema.json",
  "component": "sparkline",
  "source": "https://github.com/tishsingh399/clementine-ds",
  "version": "clementine-ds@0.1.0",
  "verified": "2026-06-11",
  "fork_model": "3-tier cascade: component → semantic → primitive.",
  "notes": [
    "Defined in packages/tokens/src/components/sparkline.json. Dependency-gated (@mantine/charts)."
  ],
  "tokens": [
    { "name": "sparkline.stroke", "tier": "component", "role": "trend-stroke", "path": "sparkline.stroke", "references": "{action.primary}", "primitive": "{palette.ink.9}", "light": "#305eb7", "status": "existing" },
    { "name": "sparkline.fill", "tier": "component", "role": "area-fill", "path": "sparkline.fill", "references": "{surface.subtle}", "primitive": "{palette.neutral.3}", "light": "#efeeec", "status": "existing" },
    { "name": "sparkline.stroke-trend-up", "tier": "component", "role": "positive-stroke", "path": "sparkline.stroke-trend-up", "references": "{feedback.success}", "primitive": "{palette.green.9}", "light": "#198044", "status": "existing" },
    { "name": "sparkline.stroke-trend-down", "tier": "component", "role": "negative-stroke", "path": "sparkline.stroke-trend-down", "references": "{feedback.error}", "primitive": "{palette.red.9}", "light": "#c1332f", "status": "existing" }
  ]
}
