{
  "$schema": "../../_templates/component/tokens.schema.json",
  "component": "export-menu",
  "source": "https://github.com/tishsingh399/clementine-ds",
  "version": "clementine-ds@0.1.0",
  "verified": "2026-06-10",
  "fork_model": "3-tier cascade: component → semantic → primitive.",
  "notes": [
    "Defined in packages/tokens/src/components/export-menu.json. Enterprise layer (Wave H)."
  ],
  "tokens": [
    { "name": "export-menu.trigger-fg", "tier": "component", "role": "trigger-fg", "path": "export-menu.trigger-fg", "references": "{text.primary}", "primitive": "{palette.neutral.12}", "light": "#2a2926", "status": "existing" },
    { "name": "export-menu.item-fg", "tier": "component", "role": "item-fg", "path": "export-menu.item-fg", "references": "{text.primary}", "primitive": "{palette.neutral.12}", "light": "#2a2926", "status": "existing" }
  ]
}
