{
  "$schema": "../../../_templates/component/tokens.schema.json",
  "component": "plan-steps",
  "source": "https://github.com/tishsingh399/clementine-ds",
  "version": "clementine-ds@0.1.0",
  "verified": "2026-06-10",
  "fork_model": "3-tier cascade: component → semantic → primitive.",
  "notes": [
    "Defined in packages/tokens/src/components/plan-steps.json. AI surface long-tail (Wave F)."
  ],
  "tokens": [
    { "name": "plan-steps.pending", "tier": "component", "role": "pending", "path": "plan-steps.pending", "references": "{text.tertiary}", "primitive": "{palette.neutral.10}", "light": "#6e6b65", "status": "existing" },
    { "name": "plan-steps.active", "tier": "component", "role": "active", "path": "plan-steps.active", "references": "{action.primary}", "primitive": "{palette.ink.9}", "light": "#305eb7", "status": "existing" },
    { "name": "plan-steps.done", "tier": "component", "role": "done", "path": "plan-steps.done", "references": "{feedback.success}", "primitive": "{palette.green.9}", "light": "#198044", "status": "existing" },
    { "name": "plan-steps.error", "tier": "component", "role": "error", "path": "plan-steps.error", "references": "{feedback.error}", "primitive": "{palette.red.9}", "light": "#c1332f", "status": "existing" },
    { "name": "plan-steps.fg", "tier": "component", "role": "fg", "path": "plan-steps.fg", "references": "{text.primary}", "primitive": "{palette.neutral.12}", "light": "#2a2926", "status": "existing" }
  ]
}
