{
  "$schema": "../../../_templates/component/tokens.schema.json",
  "component": "agent-card",
  "source": "https://github.com/tishsingh399/clementine-ds",
  "version": "clementine-ds@0.1.0",
  "verified": "2026-06-10",
  "fork_model": "3-tier cascade: component → semantic → primitive.",
  "notes": [
    "Defined in packages/tokens/src/components/agent-card.json. AI surface long-tail (Wave F)."
  ],
  "tokens": [
    { "name": "agent-card.bg", "tier": "component", "role": "bg", "path": "agent-card.bg", "references": "{surface.elevated}", "primitive": "{color.white}", "light": "#ffffff", "status": "existing" },
    { "name": "agent-card.border", "tier": "component", "role": "border", "path": "agent-card.border", "references": "{border.default}", "primitive": "{palette.neutral.6}", "light": "#d5d3d0", "status": "existing" },
    { "name": "agent-card.name", "tier": "component", "role": "name", "path": "agent-card.name", "references": "{text.primary}", "primitive": "{palette.neutral.12}", "light": "#2a2926", "status": "existing" },
    { "name": "agent-card.meta", "tier": "component", "role": "meta", "path": "agent-card.meta", "references": "{text.secondary}", "primitive": "{palette.neutral.11}", "light": "#65635e", "status": "existing" }
  ]
}
