{
  "$schema": "../../_templates/component/tokens.schema.json",
  "component": "table",
  "source": "https://github.com/tishsingh399/clementine-ds",
  "version": "clementine-ds@0.1.0",
  "verified": "2026-06-10",
  "fork_model": "3-tier cascade: component → semantic → primitive.",
  "notes": [
    "Defined in packages/tokens/src/components/table.json. Data display (Wave C)."
  ],
  "tokens": [
    { "name": "table.header-bg", "tier": "component", "role": "header-bg", "path": "table.header-bg", "references": "{surface.subtle}", "primitive": "{palette.neutral.3}", "light": "#efeeec", "status": "existing" },
    { "name": "table.header-fg", "tier": "component", "role": "header-fg", "path": "table.header-fg", "references": "{text.secondary}", "primitive": "{palette.neutral.11}", "light": "#65635e", "status": "existing" },
    { "name": "table.row-bg", "tier": "component", "role": "row-bg", "path": "table.row-bg", "references": "{surface.elevated}", "primitive": "{color.white}", "light": "#ffffff", "status": "existing" },
    { "name": "table.row-bg-striped", "tier": "component", "role": "row-bg-striped", "path": "table.row-bg-striped", "references": "{surface.default}", "primitive": "{palette.neutral.2}", "light": "#f6f6f4", "status": "existing" },
    { "name": "table.row-bg-hover", "tier": "component", "role": "row-bg-hover", "path": "table.row-bg-hover", "references": "{surface.subtle}", "primitive": "{palette.neutral.3}", "light": "#efeeec", "status": "existing" },
    { "name": "table.border", "tier": "component", "role": "border", "path": "table.border", "references": "{border.default}", "primitive": "{palette.neutral.6}", "light": "#d5d3d0", "status": "existing" },
    { "name": "table.fg", "tier": "component", "role": "fg", "path": "table.fg", "references": "{text.primary}", "primitive": "{palette.neutral.12}", "light": "#2a2926", "status": "existing" }
  ]
}
