{
  "$schema": "../../../_templates/component/tokens.schema.json",
  "component": "prompt-suggestions",
  "source": "https://github.com/tishsingh399/clementine-ds",
  "version": "clementine-ds@0.1.0",
  "verified": "2026-06-10",
  "fork_model": "3-tier cascade: component → semantic → primitive.",
  "notes": [
    "Defined in packages/tokens/src/components/prompt-suggestions.json. AI surface (Wave D)."
  ],
  "tokens": [
    { "name": "prompt-suggestions.bg", "tier": "component", "role": "bg", "path": "prompt-suggestions.bg", "references": "{surface.subtle}", "primitive": "{palette.neutral.3}", "light": "#efeeec", "status": "existing" },
    { "name": "prompt-suggestions.border", "tier": "component", "role": "border", "path": "prompt-suggestions.border", "references": "{border.default}", "primitive": "{palette.neutral.6}", "light": "#d5d3d0", "status": "existing" },
    { "name": "prompt-suggestions.fg", "tier": "component", "role": "fg", "path": "prompt-suggestions.fg", "references": "{text.primary}", "primitive": "{palette.neutral.12}", "light": "#2a2926", "status": "existing" },
    { "name": "prompt-suggestions.radius", "tier": "component", "role": "radius", "path": "prompt-suggestions.radius", "references": "{radius.xl}", "primitive": "99px", "light": "99px", "status": "existing" }
  ]
}
