{
  "$schema": "../../_templates/component/tokens.schema.json",
  "component": "fieldset",
  "source": "https://github.com/tishsingh399/clementine-ds",
  "version": "clementine-ds@0.1.0",
  "verified": "2026-06-10",
  "fork_model": "3-tier cascade: component → semantic → primitive.",
  "notes": [
    "Defined in packages/tokens/src/components/fieldset.json. Form input (Wave B)."
  ],
  "tokens": [
    { "name": "fieldset.bg", "tier": "component", "role": "bg", "path": "fieldset.bg", "references": "{surface.default}", "primitive": "{palette.neutral.2}", "light": "#f6f6f4", "status": "existing" },
    { "name": "fieldset.border", "tier": "component", "role": "border", "path": "fieldset.border", "references": "{border.default}", "primitive": "{palette.neutral.6}", "light": "#d5d3d0", "status": "existing" },
    { "name": "fieldset.legend", "tier": "component", "role": "legend", "path": "fieldset.legend", "references": "{text.primary}", "primitive": "{palette.neutral.12}", "light": "#2a2926", "status": "existing" },
    { "name": "fieldset.radius", "tier": "component", "role": "radius", "path": "fieldset.radius", "references": "{radius.md}", "primitive": "6px", "light": "6px", "status": "existing" }
  ]
}
