{
  "$schema": "../../../_templates/component/tokens.schema.json",
  "component": "message",
  "source": "https://github.com/tishsingh399/clementine-ds",
  "version": "clementine-ds@0.1.0",
  "verified": "2026-06-10",
  "fork_model": "3-tier cascade: component → semantic → primitive.",
  "notes": [
    "Defined in packages/tokens/src/components/message.json. Tray 4 (AI surface)."
  ],
  "tokens": [
    { "name": "message.user.bg", "tier": "component", "role": "user-fill", "path": "message.user.bg", "references": "{action.primary}", "primitive": "{palette.ink.9}", "light": "#305eb7", "status": "existing" },
    { "name": "message.user.fg", "tier": "component", "role": "user-text", "path": "message.user.fg", "references": "{text.on-action}", "primitive": "{color.white}", "light": "#ffffff", "status": "existing" },
    { "name": "message.assistant.bg", "tier": "component", "role": "assistant-fill", "path": "message.assistant.bg", "references": "{surface.subtle}", "primitive": "{palette.neutral.2}", "light": "#f6f6f4", "status": "existing" },
    { "name": "message.assistant.fg", "tier": "component", "role": "assistant-text", "path": "message.assistant.fg", "references": "{text.primary}", "primitive": "{palette.neutral.12}", "light": "#2a2926", "status": "existing" },
    { "name": "message.system.bg", "tier": "component", "role": "system-fill", "path": "message.system.bg", "references": "{surface.default}", "primitive": "{palette.neutral.1}", "light": "#fbfbfa", "status": "existing" },
    { "name": "message.system.fg", "tier": "component", "role": "system-text", "path": "message.system.fg", "references": "{text.secondary}", "primitive": "{palette.neutral.11}", "light": "#65635e", "status": "existing" },
    { "name": "message.meta", "tier": "component", "role": "meta-text", "path": "message.meta", "references": "{text.tertiary}", "primitive": "{palette.neutral.10}", "light": "#6e6b65", "status": "existing" },
    { "name": "message.radius", "tier": "component", "role": "corner-radius", "path": "message.radius", "references": "{radius.lg}", "primitive": "8px", "light": "8px", "status": "existing" }
  ]
}
