{
  "$schema": "../../_templates/component/tokens.schema.json",
  "component": "password-input",
  "source": "https://github.com/tishsingh399/clementine-ds",
  "version": "clementine-ds@0.1.0",
  "verified": "2026-06-10",
  "fork_model": "3-tier cascade: component → semantic → primitive.",
  "notes": [
    "Defined in packages/tokens/src/components/password-input.json. Form input (Wave B)."
  ],
  "tokens": [
    { "name": "password-input.bg", "tier": "component", "role": "bg", "path": "password-input.bg", "references": "{surface.elevated}", "primitive": "{color.white}", "light": "#ffffff", "status": "existing" },
    { "name": "password-input.border", "tier": "component", "role": "border", "path": "password-input.border", "references": "{border.strong}", "primitive": "{palette.neutral.9}", "light": "#83807a", "status": "existing" },
    { "name": "password-input.border-focus", "tier": "component", "role": "border-focus", "path": "password-input.border-focus", "references": "{focus.ring}", "primitive": "{palette.clementine.10}", "light": "#e86800", "status": "existing" },
    { "name": "password-input.fg", "tier": "component", "role": "fg", "path": "password-input.fg", "references": "{text.primary}", "primitive": "{palette.neutral.12}", "light": "#2a2926", "status": "existing" },
    { "name": "password-input.placeholder", "tier": "component", "role": "placeholder", "path": "password-input.placeholder", "references": "{text.tertiary}", "primitive": "{palette.neutral.10}", "light": "#6e6b65", "status": "existing" },
    { "name": "password-input.radius", "tier": "component", "role": "radius", "path": "password-input.radius", "references": "{radius.md}", "primitive": "6px", "light": "6px", "status": "existing" }
  ]
}
