{
  "$schema": "../../_templates/component/tokens.schema.json",
  "component": "pagination",
  "source": "https://github.com/tishsingh399/clementine-ds",
  "version": "clementine-ds@0.1.0",
  "verified": "2026-06-10",
  "fork_model": "3-tier cascade: component → semantic → primitive. Components never reference primitives directly.",
  "notes": [
    "All entries are tier=component, defined in packages/tokens/src/components/pagination.json."
  ],
  "tokens": [
    { "name": "pagination.item.fg", "tier": "component", "role": "page-color", "path": "pagination.item.fg", "references": "{text.primary}", "primitive": "{palette.neutral.12}", "light": "#2a2926", "status": "existing" },
    { "name": "pagination.item.bg-active", "tier": "component", "role": "active-fill", "path": "pagination.item.bg-active", "references": "{action.primary}", "primitive": "{palette.ink.9}", "light": "#305eb7", "status": "existing" },
    { "name": "pagination.item.fg-active", "tier": "component", "role": "active-color", "path": "pagination.item.fg-active", "references": "{text.on-action}", "primitive": "{color.white}", "light": "#ffffff", "status": "existing" },
    { "name": "pagination.item.bg-hover", "tier": "component", "role": "hover-fill", "path": "pagination.item.bg-hover", "references": "{surface.subtle}", "primitive": "{palette.neutral.3}", "light": "#efeeec", "status": "existing" },
    { "name": "pagination.border", "tier": "component", "role": "item-border", "path": "pagination.border", "references": "{border.default}", "primitive": "{palette.neutral.6}", "light": "#d5d3d0", "status": "existing" },
    { "name": "pagination.border-focus", "tier": "component", "role": "focus-ring", "path": "pagination.border-focus", "references": "{focus.ring}", "primitive": "{palette.clementine.10}", "light": "#e86800", "status": "existing" },
    { "name": "pagination.radius", "tier": "component", "role": "corner-radius", "path": "pagination.radius", "references": "{radius.md}", "primitive": "6px", "light": "6px", "status": "existing" }
  ]
}
